{
  "schemaVersion": "1",
  "root": "/knowledge",
  "revision": {
    "specVersion": "0.1",
    "indexSha256": "0000000000000000000000000000000000000000000000000000000000000000"
  },
  "query": {
    "text": "authentication",
    "limit": 12,
    "filters": {}
  },
  "routes": [],
  "fusion": {
    "method": "rrf",
    "rankConstant": 60
  },
  "results": [],
  "rejections": []
}
